{
  "checkpoints": [
    {
      "commit": "210da75e45b53b1285af7c530fde307b3a12dd01",
      "item": "M19-01",
      "summary": "architecture inventory and fitness baseline"
    },
    {
      "commit": "02efed8839b2ac16d196056d89368c9e03fa53a3",
      "item": "M19-02",
      "summary": "public surface authority; two import-time payloads deferred"
    },
    {
      "commit": "68f6bdfdbf4fa818991ee2edccabfb2fe6f9f66c",
      "item": "M19-03",
      "summary": "ComfyUI node adapter decomposition behind a node-surface record"
    },
    {
      "commit": "93a374c5ff9cb5b79db9393c80665b397bd863cf",
      "item": "M19-04",
      "summary": "product shell frontend decomposition and its layering guard"
    },
    {
      "commit": "fe0fae37180d14fbae8f732ad3a1552f6d9d18f4",
      "item": "M19-05",
      "summary": "three pure-core modules decomposed and their layering guard"
    }
  ],
  "fingerprint": "sha256:6fadddc3603c1eecad014a65df91958f2a909b3a314e0f8c2932d26ed14f6219",
  "rows": [
    {
      "domain": "architecture",
      "expectation": "constant",
      "introduced_by": "M19-01",
      "metric": "forbidden_imports",
      "readings": [
        {
          "item": "M19-01",
          "value": "0"
        },
        {
          "item": "M19-02",
          "value": "0"
        },
        {
          "item": "M19-03",
          "value": "0"
        },
        {
          "item": "M19-04",
          "value": "0"
        },
        {
          "item": "M19-05",
          "value": "0"
        }
      ],
      "source": "comfyui_h3_context/contracts/architecture_inventory_v1.json",
      "verdict": "held"
    },
    {
      "domain": "architecture",
      "expectation": "constant",
      "introduced_by": "M19-01",
      "metric": "layer_inversions",
      "readings": [
        {
          "item": "M19-01",
          "value": "0"
        },
        {
          "item": "M19-02",
          "value": "0"
        },
        {
          "item": "M19-03",
          "value": "0"
        },
        {
          "item": "M19-04",
          "value": "0"
        },
        {
          "item": "M19-05",
          "value": "0"
        }
      ],
      "source": "comfyui_h3_context/contracts/architecture_inventory_v1.json",
      "verdict": "held"
    },
    {
      "domain": "architecture",
      "expectation": "constant",
      "introduced_by": "M19-01",
      "metric": "runtime_cycles",
      "readings": [
        {
          "item": "M19-01",
          "value": "0"
        },
        {
          "item": "M19-02",
          "value": "0"
        },
        {
          "item": "M19-03",
          "value": "0"
        },
        {
          "item": "M19-04",
          "value": "0"
        },
        {
          "item": "M19-05",
          "value": "0"
        }
      ],
      "source": "comfyui_h3_context/contracts/architecture_inventory_v1.json",
      "verdict": "held"
    },
    {
      "domain": "architecture",
      "expectation": "informational",
      "introduced_by": "M19-01",
      "metric": "modules",
      "readings": [
        {
          "item": "M19-01",
          "value": "158"
        },
        {
          "item": "M19-02",
          "value": "159"
        },
        {
          "item": "M19-03",
          "value": "168"
        },
        {
          "item": "M19-04",
          "value": "168"
        },
        {
          "item": "M19-05",
          "value": "180"
        }
      ],
      "source": "comfyui_h3_context/contracts/architecture_inventory_v1.json",
      "verdict": "reported"
    },
    {
      "domain": "architecture",
      "expectation": "informational",
      "introduced_by": "M19-01",
      "metric": "largest_module_lines",
      "readings": [
        {
          "item": "M19-01",
          "value": "4423"
        },
        {
          "item": "M19-02",
          "value": "4422"
        },
        {
          "item": "M19-03",
          "value": "4422"
        },
        {
          "item": "M19-04",
          "value": "4422"
        },
        {
          "item": "M19-05",
          "value": "4422"
        }
      ],
      "source": "comfyui_h3_context/contracts/architecture_inventory_v1.json",
      "verdict": "reported"
    },
    {
      "domain": "architecture",
      "expectation": "informational",
      "introduced_by": "M19-01",
      "metric": "largest_authored_module_lines",
      "readings": [
        {
          "item": "M19-01",
          "value": "3330"
        },
        {
          "item": "M19-02",
          "value": "3330"
        },
        {
          "item": "M19-03",
          "value": "2569"
        },
        {
          "item": "M19-04",
          "value": "2569"
        },
        {
          "item": "M19-05",
          "value": "2181"
        }
      ],
      "source": "comfyui_h3_context/contracts/architecture_inventory_v1.json",
      "verdict": "reported"
    },
    {
      "domain": "surface",
      "expectation": "constant",
      "introduced_by": "M19-02",
      "metric": "pure_core_declared",
      "readings": [
        {
          "item": "M19-01",
          "value": "absent"
        },
        {
          "item": "M19-02",
          "value": "2093"
        },
        {
          "item": "M19-03",
          "value": "2093"
        },
        {
          "item": "M19-04",
          "value": "2093"
        },
        {
          "item": "M19-05",
          "value": "2093"
        }
      ],
      "source": "comfyui_h3_context/contracts/public_surface_v1.json",
      "verdict": "held"
    },
    {
      "domain": "surface",
      "expectation": "constant",
      "introduced_by": "M19-02",
      "metric": "pure_core_names_digest",
      "readings": [
        {
          "item": "M19-01",
          "value": "absent"
        },
        {
          "item": "M19-02",
          "value": "sha256:340d713ed3798388272b1bc28bb3f2ac7bd1fdfcd5f3044892f06e1ef5652f76"
        },
        {
          "item": "M19-03",
          "value": "sha256:340d713ed3798388272b1bc28bb3f2ac7bd1fdfcd5f3044892f06e1ef5652f76"
        },
        {
          "item": "M19-04",
          "value": "sha256:340d713ed3798388272b1bc28bb3f2ac7bd1fdfcd5f3044892f06e1ef5652f76"
        },
        {
          "item": "M19-05",
          "value": "sha256:340d713ed3798388272b1bc28bb3f2ac7bd1fdfcd5f3044892f06e1ef5652f76"
        }
      ],
      "source": "comfyui_h3_context/contracts/public_surface_v1.json",
      "verdict": "held"
    },
    {
      "domain": "surface",
      "expectation": "constant",
      "introduced_by": "M19-02",
      "metric": "shadowed_exports",
      "readings": [
        {
          "item": "M19-01",
          "value": "absent"
        },
        {
          "item": "M19-02",
          "value": "7"
        },
        {
          "item": "M19-03",
          "value": "7"
        },
        {
          "item": "M19-04",
          "value": "7"
        },
        {
          "item": "M19-05",
          "value": "7"
        }
      ],
      "source": "comfyui_h3_context/contracts/public_surface_v1.json",
      "verdict": "held"
    },
    {
      "domain": "contracts",
      "expectation": "constant",
      "introduced_by": "M19-01",
      "metric": "baseline_identities_retained",
      "readings": [
        {
          "item": "M19-01",
          "value": "285"
        },
        {
          "item": "M19-02",
          "value": "285"
        },
        {
          "item": "M19-03",
          "value": "285"
        },
        {
          "item": "M19-04",
          "value": "285"
        },
        {
          "item": "M19-05",
          "value": "285"
        }
      ],
      "source": "comfyui_h3_context/contracts/contract_inventory_v1.json",
      "verdict": "held"
    },
    {
      "domain": "host",
      "expectation": "constant",
      "introduced_by": "M19-03",
      "metric": "node_surface_fingerprint",
      "readings": [
        {
          "item": "M19-01",
          "value": "absent"
        },
        {
          "item": "M19-02",
          "value": "absent"
        },
        {
          "item": "M19-03",
          "value": "sha256:30230269bf4f368d9dac55d0e238f3fefbbc7ec4090059d356e51383a2528ede"
        },
        {
          "item": "M19-04",
          "value": "sha256:30230269bf4f368d9dac55d0e238f3fefbbc7ec4090059d356e51383a2528ede"
        },
        {
          "item": "M19-05",
          "value": "sha256:30230269bf4f368d9dac55d0e238f3fefbbc7ec4090059d356e51383a2528ede"
        }
      ],
      "source": "comfyui_h3_context/contracts/node_surface_v1.json",
      "verdict": "held"
    },
    {
      "domain": "host",
      "expectation": "constant",
      "introduced_by": "M19-03",
      "metric": "nodes",
      "readings": [
        {
          "item": "M19-01",
          "value": "absent"
        },
        {
          "item": "M19-02",
          "value": "absent"
        },
        {
          "item": "M19-03",
          "value": "28"
        },
        {
          "item": "M19-04",
          "value": "28"
        },
        {
          "item": "M19-05",
          "value": "28"
        }
      ],
      "source": "comfyui_h3_context/contracts/node_surface_v1.json",
      "verdict": "held"
    },
    {
      "domain": "host",
      "expectation": "constant",
      "introduced_by": "M19-03",
      "metric": "exported_names",
      "readings": [
        {
          "item": "M19-01",
          "value": "absent"
        },
        {
          "item": "M19-02",
          "value": "absent"
        },
        {
          "item": "M19-03",
          "value": "112"
        },
        {
          "item": "M19-04",
          "value": "112"
        },
        {
          "item": "M19-05",
          "value": "112"
        }
      ],
      "source": "comfyui_h3_context/contracts/node_surface_v1.json",
      "verdict": "held"
    },
    {
      "domain": "frontend",
      "expectation": "informational",
      "introduced_by": "M19-01",
      "metric": "bundle_sha256",